[
  {
    "url": "https://bdjobs.com/h/details/1457722?ln=1",
    "company_name": null,
    "job_title": null,
    "location": null,
    "salary": null,
    "experience": null,
    "education": null,
    "deadline": null,
    "job_description": "Error Cannot GET /h/details/1457722"
  },
  {
    "url": "https://bdjobs.com/h/details/1454389?ln=1",
    "company_name": null,
    "job_title": null,
    "location": null,
    "salary": null,
    "experience": null,
    "education": null,
    "deadline": null,
    "job_description": "Error Cannot GET /h/details/1454389"
  },
  {
    "url": "https://bdjobs.com/h/details/1457724?ln=1",
    "company_name": null,
    "job_title": null,
    "location": null,
    "salary": null,
    "experience": null,
    "education": null,
    "deadline": null,
    "job_description": "Error Cannot GET /h/details/1457724"
  },
  {
    "url": "https://bdjobs.com/h/details/1457713?ln=1",
    "company_name": null,
    "job_title": null,
    "location": null,
    "salary": null,
    "experience": null,
    "education": null,
    "deadline": null,
    "job_description": "Error Cannot GET /h/details/1457713"
  },
  {
    "url": "https://bdjobs.com/h/details/1457723?ln=1",
    "company_name": "Stepnextgen AI",
    "job_title": "Social Media Manager",
    "location": "Anywhere in Bangladesh",
    "salary": "Negotiable",
    "experience": "At least 1 year",
    "education": null,
    "deadline": "17 Feb 2026",
    "job_description": "Social Media Manager : Stepnextgen AI Jobs ENG বাংলা Create Account Sign In For Employer Create Sign In Home Jobs Mybdjobs Job List Stepnextgen AI Social Media Manager Application Deadline : 17 Feb 2026 Apply Now Shortlist Share: Facebook LinkedIn WhatsApp All Requirements Responsibilities Skills & Expertise Company Information Summary Vacancy: 01 Location: Anywhere in Bangladesh Salary: Negotiable Experience: At least 1 year Published: 08 Feb 2026 Applicants are encouraged to submit Video CV. To access Application Insights Get Bdjobs Pro Requirements Education Bachelor/Honors Experience At least 1 year The applicants should have experience in the following business area(s): Software Company, Artificial Intelligence (AI) Startup, Direct Selling/Marketing Service Company, Online Retail Startup Freshers are also encouraged to apply. Responsibilities & Context NakshiBari (a concern of StepNextGen AI) is looking for a creative Social Media Manager to join our growing team. If you’re passionate about digital storytelling, audience engagement, and building strong online communities, we’d love to hear from you! Requirements: -Strong understanding of Facebook, Instagram and TikTok platforms -Experience in content planning and social media strategy -Basic knowledge of Canva/Adobe tools for quick creatives -Ability to write engaging captions and copy -Understanding of trends, hashtags, and audience behavior -Ability to meet deadlines and work collaboratively Responsibilities: -Plan, create, and manage content across social media platforms -Write engaging captions and post copies aligned with the brand voice -Schedule posts and maintain a content calendar -Monitor messages, comments, and audience engagement -Track performance and prepare monthly reports -Call to merchant/customers to know the insights and plan accordingly. -Generate lead and build a community for NakshiBari ** Having a good sense of trends and visualization ability is a plus (freshers are encouraged to apply) Salary - Negotiable. How to Apply: Send your CV to career@ stepnextgenai.com Skills & Expertise Digital Marketing (Social Media Marketing) Digital content Merchant Acquisition Workplace Work from home Employment Status Full Time Job Location Anywhere in Bangladesh Company Information Stepnextgen AI Follow More jobs from this company Address: Stepnextgen AI is a dynamic Bangladeshi software company at the forefront of artificial intelligence innovation. Focused on building scalable, AI-powered infrastructure solutions, the company leverages cutting-edge machine learning and intelligent automation to empower businesses across industries. Website: https://stepnextgenai.com Business: Stepnextgen AI is a dynamic Bangladeshi software company at the forefront of artificial intelligence innovation. Focused on building scalable, AI-powered infrastructure solutions, the company leverages cutting-edge machine learning and intelligent automation to empower businesses across industries. Report this"
  },
  {
    "url": "https://bdjobs.com/h/details/1409864?ln=1",
    "company_name": "Memory Information Technology",
    "job_title": "Wordpress Designer & Developer and IT officer (Part Time / Full Time )",
    "location": "Dhaka",
    "salary": "Negotiable",
    "experience": "2 to 5 years",
    "education": null,
    "deadline": "09 Mar 2026",
    "job_description": "Wordpress Designer & Developer and IT officer (Part Time / Full Time ) : Memory Information Technology Jobs ENG বাংলা Create Account Sign In For Employer Create Sign In Home Jobs Mybdjobs Job List Memory Information Technology Wordpress Designer & Developer and IT officer (Part Time / Full Time ) Application Deadline : 09 Mar 2026 Apply Now Shortlist Share: Facebook LinkedIn WhatsApp All Requirements Responsibilities Company Information Summary Vacancy: 3 Age: 22 to 45 years Location: Dhaka Salary: Negotiable Experience: 2 to 5 years Published: 07 Feb 2026 To access Application Insights Get Bdjobs Pro Requirements Education Bachelor of Computer Application (BCA) Bachelor/Honors Experience 2 to 5 years Freshers are also encouraged to apply. Additional Requirements Age 22 to 45 years Age 24 to 30 years Experience with CMS platforms like WordPress or custom-built systems for E-commerce. Strong problem-solving abilities for diagnosing and resolving design, functionality, and performance issues. Advanced knowledge of Elementor and WordPress Practical experience with responsive design, site optimization, and technical SEO. Experience with site backup, staging workflows, and web hosting environments. Advanced expertise in Elementor for crafting custom page layouts, sections, pop-ups, and reusable templates. Primarily specialized in Elementor, with working knowledge of other WordPress theme builders. Highly skilled in the WoodMart WordPress theme, including advanced customization, performance optimization, and feature integration. Responsibilities & Context Design, build, and Maintain Company Websites and landing pages. Ensure mobile responsiveness, speed optimization, and SEO. Fix bugs, update features, and perform regular site maintenance. Work closely with design and marketing teams. Implement web analytics and tracking tools. working experience in E-commerce Site Workplace Work from home,Work at office Employment Status Full Time Job Location Dhaka Company Information Memory Information Technology Follow Address: Uttara Dhaka-1230 Business: Software Development, Website development, Domain Registration & Hosting, Internet Service, Computer Training, Report this Job / Company (রিপোর্ট) রিপোর্ট এই চাকরির জন্য বিজ্ঞাপনদাতা ব্যাক্তি/প্রতিষ্ঠান আপনার কাছ থেকে কোন অর্থ চাইলে কিংবা নিয়োগ প্রক্রিয়া চলাকালীন কোন প্রকার হয়রানিমূলক (শারীরিক/মানসিক) আচরণ করলে অতিসত্ত্বর আমাদেরকে জানান অথবা জবটি রিপোর্ট করুন। চাকরি পাওয়ার জন্য কোন ব্যাক্তি/প্রতিষ্ঠানকে অর্থ প্রদান করবেন না। চাকরিকালীন কোন প্রকার হয়রানির (শারীরিক/মানসিক) সম্ভাবনা থাকলে সেখানে জয়েন করবেন না। কোন প্রকার অর্থ লেনদেন বা নিয়োগদাতা কর্তৃক হয়রানির দায়িত্ব বিডিজবস বহন করবে না। 09638666444 , 01897627858 complain@bdjobs.com ⏸ Need any support? Our Contact Centre is available from -9 am to 8 pm (Sat to Thurs). 09638666444 01897627858 About Us About Bdjobs.com Terms & Conditions Privacy Policy Feedback Contact Us Accessibility Statement Job Seekers Bdjobs Pro My Bdjobs Panel List of Features Video Guides FAQ "
  },
  {
    "url": "https://bdjobs.com/h/details/1457715?ln=1",
    "company_name": "Malleus ENT Specialized Hospital Limited",
    "job_title": "OT Nurse",
    "location": "Dhaka",
    "salary": null,
    "experience": "At least 2 years",
    "education": null,
    "deadline": "09 Mar 2026",
    "job_description": "OT Nurse : Malleus ENT Specialized Hospital Limited Jobs ENG বাংলা Create Account Sign In For Employer Create Sign In Home Jobs Mybdjobs Job List Malleus ENT Specialized Hospital Limited OT Nurse Application Deadline : 09 Mar 2026 Apply Now Shortlist Share: Facebook LinkedIn WhatsApp All Requirements Responsibilities Skills & Expertise Salary & Benefits Company Information Summary Vacancy: -- Age: 18 to 35 years Location: Dhaka Salary: Negotiable Experience: At least 2 years Published: 07 Feb 2026 Applicants are encouraged to submit Video CV. To access Application Insights Get Bdjobs Pro Requirements Education Diploma in Nursing Bachelor of Science (BSc) in Nursing Valid nursing license (RN) from BNMC Experience At least 2 years The applicants should have experience in the following business area(s): Hospital, Diagnostic Centre, Chamber Additional Requirements Age 18 to 35 years Responsibilities & Context Please read carefully: *Must have experience working in an operation theatre. *Candidates with experience in ENT will be given preference. 1. Patient Care:· Provide direct nursing care to patients, including assessing, planning, implementing, and evaluating patient care plans. Administer medications, treatments, and therapies as prescribed by physicians, ensuring proper dosage and monitoring for side effects. Assist with diagnostic tests and procedures, and ensure timely and appropriate interventions for patient conditions. Monitor and record patient vital signs, symptoms, and responses to treatments, reporting any changes to the healthcare team. Assist in managing patients with chronic conditions, post-operative care, or acute medical conditions, ensuring optimal recovery. 2. Supervision and Mentorship: Supervise and mentor junior nursing staff, providing guidance and support to ensure the highest standards of patient care. Delegate tasks and responsibilities to junior nurses and ensure their work is completed accurately and efficiently. Offer training and support to new nursing staff and interns, promoting professional development within the nursing team. 3. Patient Education: Educate patients and their families on health conditions, treatment plans, medication administration, and post-discharge care instructions. Provide health promotion and disease prevention education to patients, encouraging healthier lifestyles and self-care. 4. Team Collaboration: Collaborate with physicians, medical staff, and other healthcare professionals to develop and implement individualized care plans for patients. Participate in patient rounds and case discussions, offering insights and recommendations based on patient assessments. Ensure effective communication between nursing staff and the interdisciplinary healthcare team to promote coordinated care. 5. Quality Assurance and Compliance: Adhere to established nursing protocols, policies, and procedures to ensure safe and effective patient care. Participate in hospital quality improvement programs, audits, and p"
  },
  {
    "url": "https://bdjobs.com/h/details/1457714?ln=1",
    "company_name": "Global Wings",
    "job_title": "Admission Officer – Work From Home (Full-Time)",
    "location": "Dhaka",
    "salary": "Tk. 30000 - 60000 (Monthly)",
    "experience": "1 to 3 years",
    "education": null,
    "deadline": "25 Feb 2026",
    "job_description": "Admission Officer – Work From Home (Full-Time) : Global Wings Jobs ENG বাংলা Create Account Sign In For Employer Create Sign In Home Jobs Mybdjobs Job List Global Wings Admission Officer – Work From Home (Full-Time) Application Deadline : 25 Feb 2026 Apply Now Shortlist Share: Facebook LinkedIn WhatsApp All Requirements Responsibilities Skills & Expertise Company Information Summary Vacancy: 5 Age: At least 18 years Location: Dhaka Salary: Tk. 30000 - 60000 (Monthly) Experience: 1 to 3 years Published: 07 Feb 2026 Applicants are encouraged to submit Video CV. To access Application Insights Get Bdjobs Pro Requirements Education Bachelor/Honors Experience 1 to 3 years The applicants should have experience in the following business area(s): Embassies/Foreign Consulate, Immigration and Education Consultancy Service, Immigration/Visa Processing, Individual/Personal Recruitment Additional Requirements Age At least 18 years Responsibilities & Context Job Context GlobalWings is a professional study abroad consultancy firm providing international education placement services for students seeking higher education overseas. We are looking for a dedicated and detail-oriented Admission Officer to manage and support our Recruitment Partners network. The position is fully remote (work from home) and requires strong coordination, documentation, and compliance management skills to ensure smooth student admission processing with partner institutions. Key Duties & Responsibilities Communicate and coordinate regularly with recruitment partners regarding student applications and admission requirements. Check and verify student documents to ensure accuracy, completeness, and compliance with institutional and visa requirements. Guide recruitment partners on admission procedures, application updates, and document corrections. Prepare, review, and submit student applications to partner universities, colleges, and institutes. Follow up with institutions regarding offer letters, admission status, and pending documents. Maintain and update student application records, CRM, and tracking systems. Assist recruitment partners in understanding partner institution requirements, policies, and compliance guidelines. Monitor application deadlines and ensure timely submission of student files. Prepare and send admission-related reports to management. Support recruitment partners in resolving admission-related queries and issues. Coordinate with internal teams for smooth student processing and service delivery. Ensure compliance with partner institution standards and ethical recruitment practices. Skills & Expertise Application in different University Portal B2B and B2C sales and marketing CRM Software Higher Study Abroad Student Admission university application process Communication in English Leadership and teamwork Highly interpersonal and communication skills Good Ms office and Emailing skill Workplace Work from home Employment Status Full Time Job Location Dhaka Company Informati"
  }
]