[
  {
    "url": "https://bdjobs.com/h/details/1456165?ln=1",
    "company_name": "organic agriculture.ltd",
    "job_title": "DVM / Animal Husbandry Officer",
    "location": "Dhaka, Gopalganj",
    "salary": null,
    "experience": "",
    "education": null,
    "deadline": "12 Feb 2026",
    "job_description": "DVM / Animal Husbandry Officer : organic agriculture.ltd Jobs ENG বাংলা Create Account Sign In For Employer Create Sign In Home Jobs Mybdjobs Job List organic agriculture.ltd DVM / Animal Husbandry Officer Application Deadline : 12 Feb 2026 Apply Now Shortlist Share: Facebook LinkedIn WhatsApp All Requirements Responsibilities Skills & Expertise Salary & Benefits Company Information Summary Vacancy: 3 Age: 25 to 40 years Location: Dhaka, Gopalganj Salary: Negotiable Published: 02 Feb 2026 To access Application Insights Get Bdjobs Pro Requirements Education Experience Additional Requirements Age 25 to 40 years Strong understanding of animal nutrition and diet formulation Practical knowledge of cattle diseases, prevention, and treatment Ability to analyze health issues and take fast, effective decisions Strong communication and team management skills Familiar with livestock industry regulations and standards Passion for animal health and welfare Able to work under pressure and handle farm-level challenges Proficiency in Google Sheets for data entry, analysis, and reporting Responsibilities & Context Organic Agriculture Limited is looking for an experienced and responsible Veterinary Doctor to manage and improve the health of a large-scale cattle farm with over 300+ cattle. This role requires hands-on farm experience, strong problem-solving ability, and the capacity to work under pressure while ensuring animal health, productivity, and welfare. Plan, organize, and supervise daily farm operations to meet production targets Monitor and maintain proper farm environment including temperature, humidity, ventilation, lighting, water, and feed supply Diagnose, prevent, and treat cattle diseases effectively Develop and implement nutrition and health improvement programs Maintain accurate records of animal health, treatments, and disease outbreaks Prepare regular health reports for project managers and senior management Ensure proper waste management and environmental control within farm premises Train, supervise, and motivate farm workers Build a culture of safety, discipline, and continuous improvement Lead end-of-cycle activities, including shed cleaning, disinfection, and preparation for new intake, ensuring effectiveness through lab testing Skills & Expertise Agrculture and livestock Agro Based company Animal Health Dairy Farm Management Suggested by animal husbandry DVM Compensation & Other Benefits T/A,Mobile bill Salary Review: Yearly Festival Bonus: 2 Accommodation Workplace Work at office Employment Status Full Time Gender Only males are allowed to apply. Job Location Dhaka, Gopalganj Company Information organic agriculture.ltd Follow More jobs from this company Address: House-1, 5th Floor, Road-18, Sector-7, Uttara, Dhaka, Bangladesh Website: https://www.organicbd.net Report this Job / Company (রিপোর্ট) রিপোর্ট এই চাকরির জন্য বিজ্ঞাপনদাতা ব্যাক্তি/প্রতিষ্ঠান আপনার কাছ থেকে কোন অর্থ চাইলে কিংবা নিয়োগ প্রক্রিয়া চলাকালীন কোন প্রকার হয়রানিমূলক (শারীরি"
  },
  {
    "url": "https://bdjobs.com/h/details/1457406?ln=1",
    "company_name": "ExploreX Visa Consultant",
    "job_title": "Customer care Executive (Female)",
    "location": "Dhaka (Naya Paltan)",
    "salary": "Negotiable",
    "experience": "At least 1 year",
    "education": null,
    "deadline": "16 Feb 2026",
    "job_description": "Customer care Executive (Female) : ExploreX Visa Consultant Jobs ENG বাংলা Create Account Sign In For Employer Create Sign In Home Jobs Mybdjobs Job List ExploreX Visa Consultant Customer care Executive (Female) Application Deadline : 16 Feb 2026 Apply Now Shortlist Share: Facebook LinkedIn WhatsApp All Requirements Responsibilities Skills & Expertise Company Information Summary Vacancy: 5 Age: 20 to 30 years Location: Dhaka (Naya Paltan) Salary: Negotiable Experience: At least 1 year Published: 06 Feb 2026 Applicants are encouraged to submit Video CV. To access Application Insights Get Bdjobs Pro Requirements Education Bachelor/Honors Higher Secondary HSC Experience At least 1 year Freshers are also encouraged to apply. Additional Requirements Age 20 to 30 years টেলিমার্কেটিং কাজে অভিজ্ঞদের গুরুত্ব দেয়া হবে। সরাসরি ক্লাইন্ট মেনেজমেন্টে অভিজ্ঞদের গুরুত্ব দেয়া হবে। স্যোসাল মিডিয়া মেন্টেন, কন্টেট ক্রিয়েটে অভিজ্ঞদের গুরুত্ব দেয়া হবে। কম্পিউটারে বেসিক নলেজ থাকতে হবে। Responsibilities & Context আমরা আমাদের প্রতিষ্ঠানের জন্য স্মার্ট, বুদ্ধিমান, শিক্ষিত ৫ জন “কাস্টমার কেয়ারএক্সিকিউটিভ/ফ্রন্ট ডেস্ক অফিসার(মহিলা)” খুঁজছি। দায়িত্ব ও প্রসঙ্গ: কাস্টমার সার্ভিস প্রদান। ফ্রন্ট ডেস্ক অফিসার এর দায়িত্বসমূহ। অফিস সময় : সকাল ১০:০০ থেকে বিকেল ৬:০০ পর্যন্ত। কর্মক্ষেত্র : অফিসে কাজ করতে হবে। Skills & Expertise Client Service Customer Care Customer Support Customer Support through Phone Good Computer Skills and Communication Suggested by Canva Receptionist/ Front Desk Visa Processing Workplace Work at office Employment Status Full Time Gender Only females are allowed to apply. Job Location Dhaka (Naya Paltan) Company Information ExploreX Visa Consultant Follow Address: Ridge Ahmed Square\r\n50/1, Inner Circular (VIP) Road,\r\n14th Floor, Gate-3, Nayapaltan,\r\nDhaka-1000, Bangladesh Website: https://explorexvisa.com/ Business: ExploreX Visa Consultancy is your trusted partner in global travel, dedicated to making your journey seamless and stress-free. Based in the heart of Dhaka, Bangladesh, we specialize in providing comprehensive travel services, including visa processing, ticketing, hotel booking, and customized travel planning for destinations around the world. Report this Job / Company (রিপোর্ট) রিপোর্ট এই চাকরির জন্য বিজ্ঞাপনদাতা ব্যাক্তি/প্রতিষ্ঠান আপনার কাছ থেকে কোন অর্থ চাইলে কিংবা নিয়োগ প্রক্রিয়া চলাকালীন কোন প্রকার হয়রানিমূলক (শারীরিক/মানসিক) আচরণ করলে অতিসত্ত্বর আমাদেরকে জানান অথবা জবটি রিপোর্ট করুন। চাকরি পাওয়ার জন্য কোন ব্যাক্তি/প্রতিষ্ঠানকে অর্থ প্রদান করবেন না। চাকরিকালীন কোন প্রকার হয়রানির (শারীরিক/মানসিক) সম্ভাবনা থাকলে সেখানে জয়েন করবেন না। কোন প্রকার অর্থ লেনদেন বা নিয়োগদাতা কর্তৃক হয়রানির দায়িত্ব বিডিজবস বহন করবে না। 09638666444 , 01897627858 complain@bdjobs.com ⏸ Project Cycle Management (PCM) for the NGO Professionals 4500 BDT Tareq Ahmed Register Now Lean Six Sigma-Yellow Belt 3500 BDT Engr. Md. Towhid Ul Alam Chowdhury Register Now ইন্টারভিউয়ের কল পেতে ফ্রিতে রেজিস্ট্রেশন করুন Employability Skills Course FREE! BDT Self-paced Learning Register Now"
  }
]